{
  "$schema": "https://json-schema.org/draft/2020-12/schema",
  "$id": "https://con001.dev/schema/position.schema.json",
  "title": "Position",
  "description": "Where one reading lands on one question's axis. A position is OUR READING OF THEIR READING — the commentator never placed themselves on our axis — so `asserted_by` records who made the placement, and `evidence` ties it to actual anchored text. See docs/10-resonance.md.",
  "type": "object",
  "required": ["id", "type", "question", "value", "confidence", "evidence", "held_by", "tradition", "summary", "asserted_by"],
  "additionalProperties": false,
  "properties": {
    "id": { "type": "string", "pattern": "^pos:" },
    "type": { "const": "Position" },
    "question": { "type": "string", "pattern": "^q:" },
    "value": { "type": "number", "minimum": 0, "maximum": 1 },
    "confidence": { "type": "number", "minimum": 0, "maximum": 1 },
    "evidence": {
      "type": "array",
      "minItems": 1,
      "items": { "type": "string", "pattern": "^interp:" },
      "description": "REQUIRED, at least one. No position exists without an anchored interpretation behind it — that rule is what keeps this from being armchair comparative religion."
    },
    "held_by": { "type": "string", "pattern": "^layer:" },
    "tradition": { "type": "string" },
    "summary": { "type": "string", "minLength": 1 },
    "asserted_by": {
      "$ref": "https://con001.dev/schema/author.schema.json",
      "description": "Who placed this reading on the axis. Never the commentator themselves."
    },
    "reviewed_by": {
      "type": "array",
      "items": { "type": "string" },
      "description": "Advisory-group sign-off. Required for positions on high-consequence questions."
    }
  }
}
