[
  {
    "id": "pos:gita.2-47.shankara",
    "type": "Position",
    "question": "q:act-and-outcome",
    "value": 0.85,
    "confidence": 0.8,
    "evidence": ["interp:gita.2-47.shankara"],
    "held_by": "layer:gita.shankara",
    "tradition": "hindu",
    "summary": "Entitlement extends to the act, never to the fruit — but the act is preparatory to knowledge rather than an end.",
    "asserted_by": { "type": "institution", "display": "con001 comparative desk" }
  },
  {
    "id": "pos:gita.2-47.tilak",
    "type": "Position",
    "question": "q:act-and-outcome",
    "value": 0.72,
    "confidence": 0.75,
    "evidence": ["interp:gita.2-47.tilak"],
    "held_by": "layer:gita.tilak",
    "tradition": "hindu",
    "summary": "Detachment from the fruit, but the act is emphatically for the world — which pulls the reading back toward consequence.",
    "asserted_by": { "type": "institution", "display": "con001 comparative desk" }
  },
  {
    "id": "pos:gita.2-47.gandhi",
    "type": "Position",
    "question": "q:act-and-outcome",
    "value": 0.92,
    "confidence": 0.8,
    "evidence": ["interp:gita.2-47.gandhi"],
    "held_by": "layer:gita.gandhi",
    "tradition": "hindu",
    "summary": "Purity of means is the whole of the matter; an act whose means are corrupt is not redeemed by its result.",
    "asserted_by": { "type": "institution", "display": "con001 comparative desk" }
  },
  {
    "id": "pos:analects.4-16.zhuxi",
    "type": "Position",
    "question": "q:act-and-outcome",
    "value": 0.78,
    "confidence": 0.7,
    "evidence": ["interp:analects.4-16.zhuxi"],
    "held_by": "layer:analects.zhuxi",
    "tradition": "confucian",
    "summary": "The noble person's mind runs first to rightness, the small person's to gain — the orientation, not the yield, is what is assessed.",
    "asserted_by": { "type": "institution", "display": "con001 comparative desk" }
  },
  {
    "id": "pos:dhp.1.buddhaghosa",
    "type": "Position",
    "question": "q:act-and-outcome",
    "value": 0.8,
    "confidence": 0.7,
    "evidence": ["interp:dhp.1.buddhaghosa"],
    "held_by": "layer:dhp.buddhaghosa",
    "tradition": "buddhist",
    "summary": "Mind precedes all things: the act is qualified by the intention that produced it, and consequence follows that.",
    "asserted_by": { "type": "institution", "display": "con001 comparative desk" }
  },
  {
    "id": "pos:upanishad.ish1.shankara",
    "type": "Position",
    "question": "q:abiding-self",
    "value": 1.0,
    "confidence": 0.9,
    "evidence": ["interp:upanishad.ish1.shankara"],
    "held_by": "layer:upanishad.shankara",
    "tradition": "hindu",
    "summary": "The self is real, abiding, and not other than the ultimate.",
    "asserted_by": { "type": "institution", "display": "con001 comparative desk" },
    "reviewed_by": ["advisory:hindu (pending)"]
  },
  {
    "id": "pos:dhp.279.buddhaghosa",
    "type": "Position",
    "question": "q:abiding-self",
    "value": 0.0,
    "confidence": 0.9,
    "evidence": ["interp:dhp.279.buddhaghosa"],
    "held_by": "layer:dhp.buddhaghosa",
    "tradition": "buddhist",
    "summary": "All dhammas without exception, the unconditioned included, are without self.",
    "asserted_by": { "type": "institution", "display": "con001 comparative desk" },
    "reviewed_by": ["advisory:buddhist (pending)"]
  },
  {
    "id": "pos:ddj.1.wangbi",
    "type": "Position",
    "question": "q:naming-the-ultimate",
    "value": 0.05,
    "confidence": 0.85,
    "evidence": ["interp:ddj.1.wangbi"],
    "held_by": "layer:ddj.wangbi",
    "tradition": "daoist",
    "summary": "What can be spoken points at affairs and shapes forms, and so is not the constant. Language does not reach it at all.",
    "asserted_by": { "type": "institution", "display": "con001 comparative desk" }
  },
  {
    "id": "pos:ddj.1.heshanggong",
    "type": "Position",
    "question": "q:naming-the-ultimate",
    "value": 0.25,
    "confidence": 0.65,
    "evidence": ["interp:ddj.1.heshanggong"],
    "held_by": "layer:ddj.heshanggong",
    "tradition": "daoist",
    "summary": "A distinction between two kinds of way — the taught and the lived — rather than a flat denial that language reaches anything.",
    "asserted_by": { "type": "institution", "display": "con001 comparative desk" }
  },
  {
    "id": "pos:quran.2-1.ibn-kathir",
    "type": "Position",
    "question": "q:naming-the-ultimate",
    "value": 0.3,
    "confidence": 0.6,
    "evidence": ["interp:quran.2-1.ibn-kathir"],
    "held_by": "layer:quran.ibn-kathir",
    "tradition": "islamic",
    "summary": "Some of what is revealed is withheld from understanding — the disconnected letters belong to the mutashābihāt, whose meaning is with God.",
    "asserted_by": { "type": "institution", "display": "con001 comparative desk" }
  },
  {
    "id": "pos:bible.jhn1-1.matthew-henry",
    "type": "Position",
    "question": "q:naming-the-ultimate",
    "value": 0.95,
    "confidence": 0.8,
    "evidence": ["interp:bible.jhn1-1.matthew-henry"],
    "held_by": "layer:bible.matthew-henry",
    "tradition": "christian",
    "summary": "The Word is the mode in which God is given; speech is not a veil over the divine but its self-disclosure.",
    "asserted_by": { "type": "institution", "display": "con001 comparative desk" }
  }
]
